<?xml version="1.0" encoding="UTF-8"?>
<movies xmlns:xsi="http://www.w3.org/2001/XMLSchema-instance" xsi:noNamespaceSchemaLocation="file:/C:/Users/user/Documents/XML/Q.no.7.xsd">
  <Movie id="m1">
    <title>Dear</title>
    <year>2014</year>
    <director name="Basanta Tamang">Basanta Tamang</director>
    <comment lang="en">Mind-bending thriller.</comment>
    <newcomment>Great visuals!</newcomment>
    <newcomment>Must watch twice.</newcomment>
  </Movie>
</movies>